{
 "id": "content.mission-card",
 "title": "Mission image card",
 "semantic": {
  "id": "content.mission-card",
  "category": "CONTENT"
 },
 "source": {
  "id": "Careers:mission:div@36",
  "file": "src/components/Careers.jsx",
  "tag": "div",
  "lines": "21-52",
  "tagLine": 36,
  "tagLineSha1": "475aa3ea555e9b67",
  "anchor": "export default function Careers",
  "anchorLine": 21
 },
 "additionalSources": [],
 "purpose": "Unflipped image card on cream with a heading and paragraphs, no overline and no button.",
 "retrievalEligible": true,
 "placement": "main",
 "variants": {
  "default": {
   "description": "single observed variant",
   "requiredFields": [],
   "forbiddenFields": [],
   "observedOn": [
    "/about"
   ]
  }
 },
 "content": {
  "budgetRule": "Budgets are COUNTS measured from the rendered clone at 1440px (extraction/measured-values.json copyBudgets); copy itself is never stored. maxWords/maxChars = the maximum observed across every route that renders this section; list sizes = observed min/max. Shorter is allowed; longer is rejected.",
  "requiredFields": [
   "heading",
   "media"
  ],
  "fields": {
   "heading": {
    "type": "text",
    "maxWords": 4,
    "maxChars": 18,
    "observedIn": 1,
    "basis": "max over measured units: title",
    "maxLines1440": 1
   },
   "lead": {
    "type": "text",
    "maxWords": 36,
    "maxChars": 250,
    "observedIn": 1,
    "basis": "max over measured units: paragraphs"
   },
   "media[].alt": {
    "type": "text",
    "maxWords": 4,
    "maxChars": 18,
    "observedIn": 1,
    "basis": "max over measured units: title"
   }
  },
  "listSizes": {
   "media": [
    1,
    1
   ]
  }
 },
 "assets": {
  "fields": {
   "media[]": {
    "type": "asset",
    "referenceRoles": [
     "photo.source-scene"
    ],
    "generatedRoles": [
     "photo.generated-scene"
    ]
   }
  },
  "note": "reference mode may use referenceRoles (evidence); generated mode must use generatedRoles (generation-safe only, pinned in code). See assets/asset-roles.json."
 },
 "generatedAssetRoles": [
  "photo.generated-scene"
 ],
 "style": {
  "props": {},
  "note": "token props take token-catalog names only (tokens/llm/token-catalog.json); allowed values per section are listed in tokens/llm/token-policy.json styleProps."
 },
 "constraints": {
  "maxPerPage": 1,
  "consecutiveVariants": []
 },
 "motion": {
  "allowedPatterns": [
   "static"
  ],
  "requiredPatterns": [],
  "reducedMotionFallback": {
   "static": "none-needed"
  }
 },
 "responsive": [
  {
   "range": "<=768",
   "behavior": "padding changes",
   "cite": "src/components/Careers.jsx:36"
  }
 ],
 "runtimeUi": [],
 "measuredHeightsPx": {
  "1440": {
   "nodes": 1,
   "minPx": 692,
   "maxPx": 692,
   "medianPx": 692,
   "sample": {
    "/about": 692
   }
  },
  "768": {
   "nodes": 1,
   "minPx": 859,
   "maxPx": 859,
   "medianPx": 859,
   "sample": {
    "/about": 859
   }
  },
  "390": {
   "nodes": 1,
   "minPx": 669,
   "maxPx": 669,
   "medianPx": 669,
   "sample": {
    "/about": 669
   }
  }
 },
 "usedByTemplates": [
  "template.about"
 ],
 "evidence": [
  "src/components/Careers.jsx:21-52"
 ]
}
