{
 "id": "content.bullet-points",
 "title": "Bullet points with image",
 "semantic": {
  "id": "content.bullet-points",
  "category": "CONTENT"
 },
 "source": {
  "id": "ContentWithBulletPoints:section@14",
  "file": "src/pages/company/sections/ContentWithBulletPoints.jsx",
  "tag": "section",
  "lines": "12-46",
  "tagLine": 14,
  "tagLineSha1": "90459129a877ef84",
  "anchor": "export default function ContentWithBulletPoints",
  "anchorLine": 12
 },
 "additionalSources": [],
 "purpose": "Centred heading and optional subtitle over a cover image beside a dashed bullet list.",
 "retrievalEligible": true,
 "placement": "main",
 "variants": {
  "default": {
   "description": "single observed variant",
   "requiredFields": [],
   "forbiddenFields": [],
   "observedOn": [
    "/solutions/students",
    "/solutions/universities"
   ]
  }
 },
 "content": {
  "budgetRule": "Budgets are COUNTS measured from the rendered clone at 1440px (extraction/measured-values.json copyBudgets); copy itself is never stored. maxWords/maxChars = the maximum observed across every route that renders this section; list sizes = observed min/max. Shorter is allowed; longer is rejected.",
  "requiredFields": [
   "bullets",
   "heading",
   "media"
  ],
  "fields": {
   "heading": {
    "type": "text",
    "maxWords": 8,
    "maxChars": 61,
    "observedIn": 2,
    "basis": "max over measured units: title",
    "maxLines1440": 1
   },
   "lead": {
    "type": "text",
    "maxWords": 28,
    "maxChars": 199,
    "observedIn": 2,
    "basis": "max over measured units: paragraphs"
   },
   "bullets[]": {
    "type": "text",
    "maxWords": 28,
    "maxChars": 199,
    "observedIn": 2,
    "basis": "max over measured units: paragraphs"
   },
   "media[].alt": {
    "type": "text",
    "maxWords": 8,
    "maxChars": 61,
    "observedIn": 2,
    "basis": "max over measured units: title"
   }
  },
  "listSizes": {
   "bullets": [
    1,
    5
   ],
   "media": [
    1,
    1
   ]
  }
 },
 "assets": {
  "fields": {
   "media[]": {
    "type": "asset",
    "referenceRoles": [
     "photo.source-scene"
    ],
    "generatedRoles": [
     "photo.generated-scene"
    ]
   }
  },
  "note": "reference mode may use referenceRoles (evidence); generated mode must use generatedRoles (generation-safe only, pinned in code). See assets/asset-roles.json."
 },
 "generatedAssetRoles": [
  "photo.generated-scene"
 ],
 "style": {
  "props": {},
  "note": "token props take token-catalog names only (tokens/llm/token-catalog.json); allowed values per section are listed in tokens/llm/token-policy.json styleProps."
 },
 "constraints": {
  "maxPerPage": 1,
  "consecutiveVariants": []
 },
 "motion": {
  "allowedPatterns": [
   "static"
  ],
  "requiredPatterns": [],
  "reducedMotionFallback": {
   "static": "none-needed"
  }
 },
 "responsive": [
  {
   "range": "<=768",
   "behavior": "grid collapses to one column",
   "cite": "src/pages/company/sections/ContentWithBulletPoints.jsx:23"
  },
  {
   "range": "<=768",
   "behavior": "margin changes",
   "cite": "src/pages/company/sections/ContentWithBulletPoints.jsx:19"
  },
  {
   "range": "<=768",
   "behavior": "padding changes",
   "cite": "src/pages/company/sections/ContentWithBulletPoints.jsx:16"
  }
 ],
 "runtimeUi": [],
 "measuredHeightsPx": {
  "1440": {
   "nodes": 2,
   "minPx": 738,
   "maxPx": 802,
   "medianPx": 770.0,
   "sample": {
    "/solutions/universities": 802,
    "/solutions/students": 738
   }
  },
  "768": {
   "nodes": 2,
   "minPx": 1078,
   "maxPx": 1165,
   "medianPx": 1121.5,
   "sample": {
    "/solutions/universities": 1165,
    "/solutions/students": 1078
   }
  },
  "390": {
   "nodes": 2,
   "minPx": 954,
   "maxPx": 1047,
   "medianPx": 1000.5,
   "sample": {
    "/solutions/universities": 1047,
    "/solutions/students": 954
   }
  }
 },
 "usedByTemplates": [
  "template.solutions-students",
  "template.solutions-universities"
 ],
 "evidence": [
  "src/pages/company/sections/ContentWithBulletPoints.jsx:12-46"
 ]
}
