{
 "id": "conversion.webinar-image-card",
 "title": "Registration image card",
 "semantic": {
  "id": "conversion.webinar-image-card",
  "category": "CONVERSION"
 },
 "source": {
  "id": "Careers:registration:div@36",
  "file": "src/components/Careers.jsx",
  "tag": "div",
  "lines": "21-52",
  "tagLine": 36,
  "tagLineSha1": "475aa3ea555e9b67",
  "anchor": "export default function Careers",
  "anchorLine": 21
 },
 "additionalSources": [],
 "purpose": "Light-orange wide-ratio image card: heading, paragraphs and a registration button.",
 "retrievalEligible": true,
 "placement": "main",
 "variants": {
  "default": {
   "description": "single observed variant",
   "requiredFields": [],
   "forbiddenFields": [],
   "observedOn": [
    "/product/oral_assessment"
   ]
  }
 },
 "content": {
  "budgetRule": "Budgets are COUNTS measured from the rendered clone at 1440px (extraction/measured-values.json copyBudgets); copy itself is never stored. maxWords/maxChars = the maximum observed across every route that renders this section; list sizes = observed min/max. Shorter is allowed; longer is rejected.",
  "requiredFields": [
   "actions",
   "heading",
   "lead",
   "media"
  ],
  "fields": {
   "heading": {
    "type": "text",
    "maxWords": 8,
    "maxChars": 43,
    "observedIn": 1,
    "basis": "max over measured units: title",
    "maxLines1440": 2
   },
   "lead": {
    "type": "text",
    "maxWords": 24,
    "maxChars": 164,
    "observedIn": 1,
    "basis": "max over measured units: paragraphs"
   },
   "actions[].label": {
    "type": "text",
    "maxWords": 3,
    "maxChars": 26,
    "observedIn": 1,
    "basis": "max over measured units: ctas"
   },
   "media[].alt": {
    "type": "text",
    "maxWords": 8,
    "maxChars": 43,
    "observedIn": 1,
    "basis": "max over measured units: title"
   }
  },
  "listSizes": {
   "actions": [
    1,
    1
   ],
   "media": [
    1,
    1
   ]
  }
 },
 "assets": {
  "fields": {
   "media[]": {
    "type": "asset",
    "referenceRoles": [
     "photo.source-scene"
    ],
    "generatedRoles": [
     "photo.generated-scene"
    ]
   }
  },
  "note": "reference mode may use referenceRoles (evidence); generated mode must use generatedRoles (generation-safe only, pinned in code). See assets/asset-roles.json."
 },
 "generatedAssetRoles": [
  "photo.generated-scene"
 ],
 "style": {
  "props": {},
  "note": "token props take token-catalog names only (tokens/llm/token-catalog.json); allowed values per section are listed in tokens/llm/token-policy.json styleProps."
 },
 "constraints": {
  "maxPerPage": 1,
  "consecutiveVariants": []
 },
 "motion": {
  "allowedPatterns": [
   "static"
  ],
  "requiredPatterns": [],
  "reducedMotionFallback": {
   "static": "none-needed"
  }
 },
 "responsive": [
  {
   "range": "<=768",
   "behavior": "padding changes",
   "cite": "src/components/Careers.jsx:36"
  }
 ],
 "runtimeUi": [],
 "measuredHeightsPx": {
  "1440": {
   "nodes": 1,
   "minPx": 815,
   "maxPx": 815,
   "medianPx": 815,
   "sample": {
    "/product/oral_assessment": 815
   }
  },
  "768": {
   "nodes": 1,
   "minPx": 1001,
   "maxPx": 1001,
   "medianPx": 1001,
   "sample": {
    "/product/oral_assessment": 1001
   }
  },
  "390": {
   "nodes": 1,
   "minPx": 937,
   "maxPx": 937,
   "medianPx": 937,
   "sample": {
    "/product/oral_assessment": 937
   }
  }
 },
 "usedByTemplates": [
  "template.product-oral"
 ],
 "evidence": [
  "src/components/Careers.jsx:21-52"
 ]
}
