{
 "id": "proof.impact-counter",
 "title": "Impact counters",
 "semantic": {
  "id": "proof.impact-counter",
  "category": "PROOF"
 },
 "source": {
  "id": "ImpactCounter:div@27",
  "file": "src/components/ImpactCounter.jsx",
  "tag": "div",
  "lines": "21-47",
  "tagLine": 27,
  "tagLineSha1": "d0d5392cf2a7d553",
  "anchor": "export default function ImpactCounter",
  "anchorLine": 21
 },
 "additionalSources": [],
 "purpose": "Row of headline statistics that count up from zero when scrolled into view, each with a caption.",
 "retrievalEligible": true,
 "placement": "main",
 "variants": {
  "orange": {
   "description": "orange background",
   "requiredFields": [],
   "forbiddenFields": [],
   "observedOn": [
    "/about"
   ]
  },
  "orange-row": {
   "description": "orange background, wide single-row layout",
   "requiredFields": [],
   "forbiddenFields": [],
   "observedOn": [
    "/careers"
   ]
  },
  "white": {
   "description": "white background",
   "requiredFields": [],
   "forbiddenFields": [],
   "observedOn": [
    "/",
    "/pricing"
   ]
  }
 },
 "content": {
  "budgetRule": "Budgets are COUNTS measured from the rendered clone at 1440px (extraction/measured-values.json copyBudgets); copy itself is never stored. maxWords/maxChars = the maximum observed across every route that renders this section; list sizes = observed min/max. Shorter is allowed; longer is rejected.",
  "requiredFields": [
   "items"
  ],
  "fields": {
   "eyebrow": {
    "type": "text",
    "maxWords": 4,
    "maxChars": 25,
    "observedIn": 4,
    "basis": "max over measured units: labels"
   },
   "items[].title": {
    "type": "text",
    "maxWords": 4,
    "maxChars": 25,
    "observedIn": 4,
    "basis": "max over measured units: labels"
   },
   "items[].text": {
    "type": "text",
    "maxWords": 1,
    "maxChars": 3,
    "observedIn": 4,
    "basis": "max over measured units: title + secondaryHeadings"
   }
  },
  "listSizes": {
   "items": [
    1,
    4
   ]
  }
 },
 "assets": {
  "fields": {},
  "note": "reference mode may use referenceRoles (evidence); generated mode must use generatedRoles (generation-safe only, pinned in code). See assets/asset-roles.json."
 },
 "generatedAssetRoles": [],
 "style": {
  "props": {
   "surface": {
    "allowed": [
     "color.surface.white",
     "color.surface.warm"
    ],
    "evidence": "src/pages/company/About.jsx:29"
   }
  },
  "note": "token props take token-catalog names only (tokens/llm/token-catalog.json); allowed values per section are listed in tokens/llm/token-policy.json styleProps."
 },
 "constraints": {
  "maxPerPage": 1,
  "consecutiveVariants": []
 },
 "motion": {
  "allowedPatterns": [
   "counter.count-up"
  ],
  "requiredPatterns": [
   "counter.count-up"
  ],
  "reducedMotionFallback": {
   "counter.count-up": "final-value"
  }
 },
 "responsive": [
  {
   "range": "<=990",
   "behavior": "grid collapses to one column",
   "cite": "src/components/ImpactCounter.jsx:25"
  },
  {
   "range": "<=768",
   "behavior": "items stack vertically",
   "cite": "src/components/ImpactCounter.jsx:24"
  },
  {
   "range": "<=768",
   "behavior": "padding changes",
   "cite": "src/components/ImpactCounter.jsx:29"
  }
 ],
 "runtimeUi": [],
 "measuredHeightsPx": {
  "1440": {
   "nodes": 4,
   "minPx": 255,
   "maxPx": 328,
   "medianPx": 271.5,
   "sample": {
    "/": 255,
    "/pricing": 255,
    "/about": 288
   }
  },
  "768": {
   "nodes": 4,
   "minPx": 449,
   "maxPx": 645,
   "medianPx": 475.5,
   "sample": {
    "/": 449,
    "/pricing": 449,
    "/about": 502
   }
  },
  "390": {
   "nodes": 4,
   "minPx": 449,
   "maxPx": 645,
   "medianPx": 475.5,
   "sample": {
    "/": 449,
    "/pricing": 449,
    "/about": 502
   }
  }
 },
 "usedByTemplates": [
  "template.about",
  "template.careers",
  "template.home",
  "template.pricing"
 ],
 "evidence": [
  "src/components/ImpactCounter.jsx:21-47"
 ]
}
