{
 "id": "conversion.image-cta-band",
 "title": "Image call-to-action band",
 "semantic": {
  "id": "conversion.image-cta-band",
  "category": "CONVERSION"
 },
 "source": {
  "id": "ImageCta:section:div@85",
  "file": "src/sections/ImageCta.jsx",
  "tag": "div",
  "lines": "44-99",
  "tagLine": 85,
  "tagLineSha1": "7e1a8b045d1577bc",
  "anchor": "export default function ImageCta",
  "anchorLine": 44
 },
 "additionalSources": [],
 "purpose": "Orange sheet with spacers around a heading and a two-button card beside an image.",
 "retrievalEligible": true,
 "placement": "main",
 "variants": {
  "default": {
   "description": "single observed variant",
   "requiredFields": [],
   "forbiddenFields": [],
   "observedOn": [
    "/case-studies",
    "/news",
    "/teacher-guides"
   ]
  }
 },
 "content": {
  "budgetRule": "Budgets are COUNTS measured from the rendered clone at 1440px (extraction/measured-values.json copyBudgets); copy itself is never stored. maxWords/maxChars = the maximum observed across every route that renders this section; list sizes = observed min/max. Shorter is allowed; longer is rejected.",
  "requiredFields": [
   "actions",
   "heading",
   "media"
  ],
  "fields": {
   "heading": {
    "type": "text",
    "maxWords": 6,
    "maxChars": 50,
    "observedIn": 3,
    "basis": "max over measured units: title",
    "maxLines1440": 2
   },
   "actions[].label": {
    "type": "text",
    "maxWords": 4,
    "maxChars": 16,
    "observedIn": 3,
    "basis": "max over measured units: ctas"
   },
   "media[].alt": {
    "type": "text",
    "maxWords": 6,
    "maxChars": 50,
    "observedIn": 3,
    "basis": "max over measured units: title"
   }
  },
  "listSizes": {
   "actions": [
    1,
    2
   ],
   "media": [
    1,
    1
   ]
  }
 },
 "assets": {
  "fields": {
   "media[]": {
    "type": "asset",
    "referenceRoles": [
     "product.screenshot"
    ],
    "generatedRoles": [
     "product.generated-visual"
    ]
   }
  },
  "note": "reference mode may use referenceRoles (evidence); generated mode must use generatedRoles (generation-safe only, pinned in code). See assets/asset-roles.json."
 },
 "generatedAssetRoles": [
  "product.generated-visual"
 ],
 "style": {
  "props": {},
  "note": "token props take token-catalog names only (tokens/llm/token-catalog.json); allowed values per section are listed in tokens/llm/token-policy.json styleProps."
 },
 "constraints": {
  "maxPerPage": 1,
  "consecutiveVariants": []
 },
 "motion": {
  "allowedPatterns": [
   "static"
  ],
  "requiredPatterns": [],
  "reducedMotionFallback": {
   "static": "none-needed"
  }
 },
 "responsive": [
  {
   "range": "<=990",
   "behavior": "grid collapses to one column",
   "cite": "src/sections/ImageCta.jsx:57"
  },
  {
   "range": "<=768",
   "behavior": "gap changes",
   "cite": "src/sections/ImageCta.jsx:61"
  },
  {
   "range": "<=768",
   "behavior": "margin changes",
   "cite": "src/sections/ImageCta.jsx:63"
  },
  {
   "range": "<=768",
   "behavior": "padding changes",
   "cite": "src/sections/ImageCta.jsx:85"
  },
  {
   "range": "<=768",
   "behavior": "padding removed",
   "cite": "src/sections/ImageCta.jsx:63"
  }
 ],
 "runtimeUi": [],
 "measuredHeightsPx": {
  "1440": {
   "nodes": 3,
   "minPx": 795,
   "maxPx": 795,
   "medianPx": 795,
   "sample": {
    "/news": 795,
    "/case-studies": 795,
    "/teacher-guides": 795
   }
  },
  "768": {
   "nodes": 3,
   "minPx": 905,
   "maxPx": 905,
   "medianPx": 905,
   "sample": {
    "/news": 905,
    "/case-studies": 905,
    "/teacher-guides": 905
   }
  },
  "390": {
   "nodes": 3,
   "minPx": 650,
   "maxPx": 650,
   "medianPx": 650,
   "sample": {
    "/news": 650,
    "/case-studies": 650,
    "/teacher-guides": 650
   }
  }
 },
 "usedByTemplates": [
  "template.case-studies-listing",
  "template.news-listing",
  "template.teacher-guides-listing"
 ],
 "evidence": [
  "src/sections/ImageCta.jsx:44-99"
 ]
}
