{
 "id": "content.careers-card",
 "title": "Careers teaser card",
 "semantic": {
  "id": "content.careers-card",
  "category": "CONTENT"
 },
 "source": {
  "id": "Careers:teaser:div@36",
  "file": "src/components/Careers.jsx",
  "tag": "div",
  "lines": "21-52",
  "tagLine": 36,
  "tagLineSha1": "475aa3ea555e9b67",
  "anchor": "export default function Careers",
  "anchorLine": 21
 },
 "additionalSources": [],
 "purpose": "Image card with an overlapping white card: overline, short heading and a link to the careers page.",
 "retrievalEligible": true,
 "placement": "main",
 "variants": {
  "default": {
   "description": "single observed variant",
   "requiredFields": [],
   "forbiddenFields": [],
   "observedOn": [
    "/",
    "/about"
   ]
  }
 },
 "content": {
  "budgetRule": "Budgets are COUNTS measured from the rendered clone at 1440px (extraction/measured-values.json copyBudgets); copy itself is never stored. maxWords/maxChars = the maximum observed across every route that renders this section; list sizes = observed min/max. Shorter is allowed; longer is rejected.",
  "requiredFields": [
   "actions",
   "heading",
   "media"
  ],
  "fields": {
   "eyebrow": {
    "type": "text",
    "maxWords": 1,
    "maxChars": 7,
    "observedIn": 2,
    "basis": "max over measured units: labels"
   },
   "heading": {
    "type": "text",
    "maxWords": 13,
    "maxChars": 67,
    "observedIn": 2,
    "basis": "max over measured units: title",
    "maxLines1440": 2
   },
   "actions[].label": {
    "type": "text",
    "maxWords": 2,
    "maxChars": 10,
    "observedIn": 2,
    "basis": "max over measured units: ctas"
   },
   "media[].alt": {
    "type": "text",
    "maxWords": 1,
    "maxChars": 7,
    "observedIn": 2,
    "basis": "max over measured units: labels"
   }
  },
  "listSizes": {
   "actions": [
    1,
    1
   ],
   "media": [
    1,
    1
   ]
  }
 },
 "assets": {
  "fields": {
   "media[]": {
    "type": "asset",
    "referenceRoles": [
     "photo.source-scene"
    ],
    "generatedRoles": [
     "photo.generated-scene"
    ]
   }
  },
  "note": "reference mode may use referenceRoles (evidence); generated mode must use generatedRoles (generation-safe only, pinned in code). See assets/asset-roles.json."
 },
 "generatedAssetRoles": [
  "photo.generated-scene"
 ],
 "style": {
  "props": {},
  "note": "token props take token-catalog names only (tokens/llm/token-catalog.json); allowed values per section are listed in tokens/llm/token-policy.json styleProps."
 },
 "constraints": {
  "maxPerPage": 1,
  "consecutiveVariants": []
 },
 "motion": {
  "allowedPatterns": [
   "static"
  ],
  "requiredPatterns": [],
  "reducedMotionFallback": {
   "static": "none-needed"
  }
 },
 "responsive": [
  {
   "range": "<=768",
   "behavior": "padding changes",
   "cite": "src/components/Careers.jsx:36"
  }
 ],
 "runtimeUi": [],
 "measuredHeightsPx": {
  "1440": {
   "nodes": 2,
   "minPx": 692,
   "maxPx": 692,
   "medianPx": 692.0,
   "sample": {
    "/": 692,
    "/about": 692
   }
  },
  "768": {
   "nodes": 2,
   "minPx": 899,
   "maxPx": 899,
   "medianPx": 899.0,
   "sample": {
    "/": 899,
    "/about": 899
   }
  },
  "390": {
   "nodes": 2,
   "minPx": 626,
   "maxPx": 626,
   "medianPx": 626.0,
   "sample": {
    "/": 626,
    "/about": 626
   }
  }
 },
 "usedByTemplates": [
  "template.about",
  "template.home"
 ],
 "evidence": [
  "src/components/Careers.jsx:21-52"
 ]
}
