{
 "id": "proof.team-quotes",
 "title": "Team quotes",
 "semantic": {
  "id": "proof.team-quotes",
  "category": "PROOF"
 },
 "source": {
  "id": "TeamQuotes:div@10",
  "file": "src/pages/company/sections/TeamQuotes.jsx",
  "tag": "div",
  "lines": "8-37",
  "tagLine": 10,
  "tagLineSha1": "167d226bdfca19fa",
  "anchor": "export default function TeamQuotes",
  "anchorLine": 8
 },
 "additionalSources": [],
 "purpose": "Grid of staff cards: photo, name, role and a short quote.",
 "retrievalEligible": true,
 "placement": "main",
 "variants": {
  "default": {
   "description": "single observed variant",
   "requiredFields": [],
   "forbiddenFields": [],
   "observedOn": [
    "/careers"
   ]
  }
 },
 "content": {
  "budgetRule": "Budgets are COUNTS measured from the rendered clone at 1440px (extraction/measured-values.json copyBudgets); copy itself is never stored. maxWords/maxChars = the maximum observed across every route that renders this section; list sizes = observed min/max. Shorter is allowed; longer is rejected.",
  "requiredFields": [
   "heading",
   "items",
   "media"
  ],
  "fields": {
   "heading": {
    "type": "text",
    "maxWords": 4,
    "maxChars": 18,
    "observedIn": 1,
    "basis": "max over measured units: title",
    "maxLines1440": 1
   },
   "items[].title": {
    "type": "text",
    "maxWords": 5,
    "maxChars": 38,
    "observedIn": 1,
    "basis": "max over measured units: secondaryHeadings"
   },
   "items[].text": {
    "type": "text",
    "maxWords": 49,
    "maxChars": 351,
    "observedIn": 1,
    "basis": "max over measured units: paragraphs"
   },
   "media[].alt": {
    "type": "text",
    "maxWords": 4,
    "maxChars": 18,
    "observedIn": 1,
    "basis": "max over measured units: title"
   }
  },
  "listSizes": {
   "items": [
    1,
    3
   ],
   "media": [
    1,
    3
   ]
  }
 },
 "assets": {
  "fields": {
   "media[]": {
    "type": "asset",
    "referenceRoles": [
     "person.photo"
    ],
    "generatedRoles": [
     "person.fictional-avatar"
    ]
   }
  },
  "note": "reference mode may use referenceRoles (evidence); generated mode must use generatedRoles (generation-safe only, pinned in code). See assets/asset-roles.json."
 },
 "generatedAssetRoles": [
  "person.fictional-avatar"
 ],
 "style": {
  "props": {},
  "note": "token props take token-catalog names only (tokens/llm/token-catalog.json); allowed values per section are listed in tokens/llm/token-policy.json styleProps."
 },
 "constraints": {
  "maxPerPage": 1,
  "consecutiveVariants": []
 },
 "motion": {
  "allowedPatterns": [
   "static"
  ],
  "requiredPatterns": [],
  "reducedMotionFallback": {
   "static": "none-needed"
  }
 },
 "responsive": [
  {
   "range": "<=768",
   "behavior": "grid collapses to one column",
   "cite": "src/pages/company/sections/TeamQuotes.jsx:13"
  },
  {
   "range": "<=768",
   "behavior": "margin changes",
   "cite": "src/pages/company/sections/TeamQuotes.jsx:26"
  },
  {
   "range": "<=768",
   "behavior": "padding changes",
   "cite": "src/pages/company/sections/TeamQuotes.jsx:10"
  }
 ],
 "runtimeUi": [],
 "measuredHeightsPx": {
  "1440": {
   "nodes": 1,
   "minPx": 943,
   "maxPx": 943,
   "medianPx": 943,
   "sample": {
    "/careers": 943
   }
  },
  "768": {
   "nodes": 1,
   "minPx": 2656,
   "maxPx": 2656,
   "medianPx": 2656,
   "sample": {
    "/careers": 2656
   }
  },
  "390": {
   "nodes": 1,
   "minPx": 1965,
   "maxPx": 1965,
   "medianPx": 1965,
   "sample": {
    "/careers": 1965
   }
  }
 },
 "usedByTemplates": [
  "template.careers"
 ],
 "evidence": [
  "src/pages/company/sections/TeamQuotes.jsx:8-37"
 ]
}
